{
  "schema_version": 1,
  "artifact_id": "artifact_render_page_image_page_1",
  "job_id": "job_01J00000000000000000000000",
  "run_id": "run_01J00000000000000000000000",
  "attempt_id": "attempt_01J00000000000000000000000",
  "stage": "render",
  "kind": "page_image",
  "page_number": 1,
  "uri": "file:///runtime/runs/run_01J00000000000000000000000/output/pages/page_1.png",
  "media_type": "image/png",
  "size_bytes": 48210,
  "created_at": "2026-07-22T00:00:02Z",
  "coordinate_space": {
    "type": "page_pixels",
    "bbox_format": "xyxy",
    "origin": "top_left",
    "width": 1654,
    "height": 2339,
    "dpi": 200
  }
}
